{"$schema":"https://json-schema.org/draft/2020-12/schema","$id":"https://agensfield.dev/scriba/schemas/status.schema.json","title":"Scriba status output","type":"object","additionalProperties":false,"required":["schemaVersion","generatedAt","providers"],"properties":{"schemaVersion":{"const":"scriba.v1"},"generatedAt":{"type":"string","format":"date-time"},"timezone":{"type":"string","minLength":1},"providers":{"type":"array","items":{"$ref":"#/$defs/provider"}}},"$defs":{"provenance":{"type":"object","additionalProperties":false,"required":["kind","providerId"],"properties":{"kind":{"type":"string","minLength":1},"providerId":{"type":"string","minLength":1},"fetchedAt":{"type":"string","format":"date-time"},"cacheAgeMs":{"type":"integer","minimum":0},"stale":{"type":"boolean"},"error":{"type":"string"}}},"format":{"type":"object","additionalProperties":false,"required":["kind"],"properties":{"kind":{"type":"string","minLength":1},"suffix":{"type":"string"}}},"line":{"type":"object","additionalProperties":false,"required":["type","label"],"properties":{"type":{"type":"string","minLength":1},"label":{"type":"string","minLength":1},"value":{},"format":{"$ref":"#/$defs/format"},"used":{"type":"number"},"limit":{"type":"number"},"resetsAt":{"type":"string","format":"date-time"},"periodDurationMs":{"type":"integer","minimum":0},"text":{"type":"string"},"provenance":{"type":"array","items":{"$ref":"#/$defs/provenance"}}}},"provider":{"type":"object","additionalProperties":false,"required":["providerId","displayName","state","lines","provenance"],"properties":{"providerId":{"type":"string","minLength":1},"displayName":{"type":"string","minLength":1},"state":{"type":"string","minLength":1},"plan":{"type":"string"},"lines":{"type":"array","items":{"$ref":"#/$defs/line"}},"provenance":{"type":"array","items":{"$ref":"#/$defs/provenance"}},"accountId":{"type":"string","pattern":"^acct-[0-9a-f]{20}$"},"accountAlias":{"type":"string","minLength":1,"maxLength":32},"observedAt":{"type":"string","format":"date-time"},"observedAgeMs":{"type":"integer","minimum":0},"observationStale":{"type":"boolean"},"credentialsAvailable":{"type":"boolean"}}}}}
