{"generatedAt":"2026-07-12T09:00:00Z","providers":[{"displayName":"Codex","lines":[{"label":"Weekly","limit":100,"provenance":[{"fetchedAt":"2026-07-12T09:00:00Z","kind":"provider-api","providerId":"codex"}],"type":"progress","used":17.5}],"plan":"pro","provenance":[{"fetchedAt":"2026-07-12T09:00:00Z","kind":"provider-api","providerId":"codex"}],"providerId":"codex","state":"ok"}],"schemaVersion":"scriba.v1","timezone":"Europe/Istanbul"}
